{
  "snapshotId": "urn:missionweave:snapshot:mission-one-final",
  "groupId": "urn:missionweave:group:mission-one",
  "throughSequence": 42,
  "eventIds": ["urn:missionweave:event:one", "urn:missionweave:event:two"],
  "stateHash": "sha256:aaaaaaaaaaaaaaaaaaaaaaaaaaaaaaaaaaaaaaaaaaaaaaaaaaaaaaaaaaaaaaaa",
  "policyLog": [
    {
      "entryId": "urn:missionweave:policy-log:approval",
      "decision": "Verified exact signed human approval.",
      "actor": { "type": "service", "id": "urn:missionweave:service:authorization" },
      "occurredAt": "2026-07-15T02:00:00Z",
      "details": { "approvalId": "urn:missionweave:approval:final" }
    }
  ],
  "createdBy": { "type": "service", "id": "urn:missionweave:service:group-authority" },
  "createdAt": "2026-07-15T02:00:00Z",
  "signature": {
    "algorithm": "Ed25519",
    "keyId": "urn:missionweave:key:group-authority",
    "createdAt": "2026-07-15T02:00:00Z",
    "value": "c2lnbmF0dXJl"
  }
}
